{
  "$schema": "https://json-schema.org/draft/2020-12/schema",
  "title": "Delivery Ticket v2.0",
  "description": "Structural schema for the canonical Delivery Ticket artifact.",
  "type": "object",
  "additionalProperties": false,
  "properties": {
    "schema_version": {},
    "feature_slug": { "$ref": "#/$defs/feature_slug" },
    "ticket_id": { "$ref": "#/$defs/ticket_id" },
    "revision": { "$ref": "#/$defs/revision" },
    "replaces_revision": { "type": [ "integer", "null" ], "minimum": 1 },
    "repo_target": { "$ref": "#/$defs/repository_key" },
    "branch": { "$ref": "#/$defs/machine_string" },
    "base_commit": { "$ref": "#/$defs/commit_sha" },
    "goal": { "$ref": "#/$defs/single_line_prose" },
    "context": { "$ref": "#/$defs/multiline_prose" },
    "scope": { "$ref": "#/$defs/scope" },
    "depends_on": { "type": "array", "items": { "$ref": "#/$defs/dependency_reference" } },
    "required_invariants": { "type": "array", "items": { "$ref": "#/$defs/single_line_prose" } },
    "forbidden_behaviors": { "type": "array", "items": { "$ref": "#/$defs/single_line_prose" } },
    "implementation_obligations": { "type": "array", "items": { "$ref": "#/$defs/implementation_obligation" } },
    "proof_obligations": { "type": "array", "items": { "$ref": "#/$defs/single_line_prose" } },
    "validation_commands": { "type": "array", "items": { "$ref": "#/$defs/validation_command" } },
    "transition_applicability": { "enum": [ "not_required", "required" ] },
    "explicit_deferrals": { "type": "array", "items": { "$ref": "#/$defs/single_line_prose" } },
    "cancellation": { "$ref": "#/$defs/cancellation" },
    "completion_criteria": { "$ref": "#/$defs/criteria_array" }
  },
  "required": [ "feature_slug", "ticket_id", "revision", "replaces_revision", "repo_target", "branch", "base_commit", "goal", "context", "scope", "depends_on", "required_invariants", "forbidden_behaviors", "implementation_obligations", "proof_obligations", "validation_commands", "transition_applicability", "explicit_deferrals", "completion_criteria" ],
  "allOf": [
    {
      "if": { "required": [ "cancellation" ] },
      "then": {
        "properties": {
          "depends_on": { "maxItems": 0 },
          "required_invariants": { "maxItems": 0 },
          "forbidden_behaviors": { "maxItems": 0 },
          "implementation_obligations": { "maxItems": 0 },
          "proof_obligations": { "maxItems": 0 },
          "validation_commands": { "maxItems": 0 },
          "transition_applicability": { "const": "not_required" },
          "explicit_deferrals": { "maxItems": 0 }
        }
      },
      "else": {
        "properties": {
          "implementation_obligations": { "minItems": 1 },
          "proof_obligations": { "minItems": 1 },
          "validation_commands": { "minItems": 1 }
        }
      }
    }
  ],
  "$defs": {
    "feature_slug": { "type": "string", "pattern": "^(?!.*[\\r\\n])[a-z0-9]+(?:-[a-z0-9]+)*$" },
    "ticket_id": { "type": "string", "pattern": "^[A-Z][A-Z0-9]*(?:-[A-Z0-9]+)*$" },
    "revision": { "type": "integer", "minimum": 1 },
    "single_line_prose": { "type": "string", "pattern": "^(?!.*[\\r\\n])(?!\\s*$)[^\\r\\n]*\\S[^\\r\\n]*$" },
    "multiline_prose": { "type": "string", "pattern": "^[\\s\\S]*\\S[\\s\\S]*$" },
    "machine_string": { "type": "string", "pattern": "^(?!.*[\\r\\n])(?!\\s*$)(?!\\s)(?!.*\\s$)[^\\u0000-\\u001F\\u007F]+$" },
    "repository_key": { "$ref": "#/$defs/machine_string" },
    "commit_sha": { "type": "string", "pattern": "^(?!.*[\\r\\n])[0-9a-f]{40}$" },
    "source_area": { "type": "string", "pattern": "^(?!.*[\\r\\n])(?!/)(?![A-Za-z]:)(?!//)(?!.*\\\\)(?!.*(?:^|/)\\.\\.?$)(?!.*(?:^|/)\\.\\.?/)(?!\\s)(?!.*\\s$)(?!.*[\\u0000-\\u001F\\u007F]).*\\S.*$" },
    "working_directory": { "type": "string", "pattern": "^(?:$|(?!/)(?![A-Za-z]:)(?!//)(?!.*\\\\)(?!.*(?:^|/)\\.\\.?$)(?!.*(?:^|/)\\.\\.?/)(?!\\s)(?!.*\\s$)(?!.*[\\u0000-\\u001F\\u007F]).*\\S.*)$" },
    "criteria_array": { "type": "array", "minItems": 1, "items": { "$ref": "#/$defs/single_line_prose" } },
    "scope": {
      "type": "object",
      "additionalProperties": false,
      "properties": { "in_scope": { "$ref": "#/$defs/criteria_array" }, "out_of_scope": { "$ref": "#/$defs/criteria_array" } },
      "required": [ "in_scope", "out_of_scope" ]
    },
    "dependency_reference": {
      "type": "object",
      "additionalProperties": false,
      "properties": { "ticket_id": { "$ref": "#/$defs/ticket_id" }, "revision": { "$ref": "#/$defs/revision" } },
      "required": [ "ticket_id", "revision" ]
    },
    "implementation_obligation": {
      "type": "object",
      "additionalProperties": false,
      "properties": {
        "source_area": { "oneOf": [ { "$ref": "#/$defs/source_area" }, { "type": "null" } ] },
        "obligation": { "$ref": "#/$defs/single_line_prose" },
        "prerequisites": { "type": "array", "items": { "$ref": "#/$defs/single_line_prose" } }
      },
      "required": [ "source_area", "obligation", "prerequisites" ]
    },
    "validation_command": {
      "type": "object",
      "additionalProperties": false,
      "properties": {
        "working_directory": { "$ref": "#/$defs/working_directory" },
        "command": { "$ref": "#/$defs/single_line_prose" },
        "expected": { "$ref": "#/$defs/single_line_prose" }
      },
      "required": [ "working_directory", "command", "expected" ]
    },
    "cancellation": {
      "type": "object",
      "additionalProperties": false,
      "properties": { "reason": { "$ref": "#/$defs/single_line_prose" } },
      "required": [ "reason" ]
    }
  }
}
